{
  "schema_version": "1.0",
  "updated_at": "2026-08-09T14:57:13+00:00",
  "next_workspace_number": 6,
  "workspaces": [
    {
      "workspace_id": "W001",
      "display_name": "MPP2 paired MSE vs Huber delta1",
      "experiment_id": "mpp2_huber_loss_paired_v001_20260728",
      "protocol_revision": 2,
      "status": "shadow",
      "active_attempt_id": null,
      "lease": null,
      "opened_at": "2026-07-28T14:18:14+00:00",
      "last_verified_at": "2026-08-09T13:49:50+00:00",
      "close_eligibility": "blocked_nonterminal_attempt_events",
      "retention_policy": "retain_until_explicit_close_approval",
      "hosts": {
        "local": {
          "host_scope": "local",
          "branch": "codex/w001-mpp2-huber-loss-20260728-bound",
          "path_id": "local_experiment_workspaces",
          "relative_path": "D:\\AI空间转录病理研究\\PFMval_new_governed_workspaces\\W001",
          "current_source_commit": "a04319a1d6aeafcd35d6adc7e2893f1d7b683bda"
        }
      }
    },
    {
      "workspace_kind": "governance_maintenance",
      "workspace_id": "W002",
      "display_name": "G15 server execution roundtrip v1 governance maintenance",
      "experiment_id": "governance_g15_server_execution_roundtrip_v1_20260729",
      "protocol_revision": 1,
      "status": "tombstoned",
      "active_attempt_id": null,
      "lease": null,
      "opened_at": "2026-07-29T15:50:50+00:00",
      "last_verified_at": "2026-08-09T14:57:13+00:00",
      "close_eligibility": "closed_user_approved_worktree_removed",
      "retention_policy": "preserve_branch_and_git_history",
      "hosts": {
        "local": {
          "host_scope": "local",
          "branch": "codex/w002-server-execution-roundtrip-v1-20260729",
          "path_id": "local_experiment_workspaces",
          "relative_path": "D:\\AI空间转录病理研究\\PFMval_new_governed_workspaces\\W002",
          "current_source_commit": "05df5debe1ece3305604310463643c2f0a3c3f61"
        }
      }
    },
    {
      "workspace_kind": "governance_maintenance",
      "workspace_id": "W003",
      "display_name": "G16 scientific records lifecycle v1 governance maintenance",
      "experiment_id": "governance_g16_scientific_records_lifecycle_v1_20260730",
      "protocol_revision": 1,
      "status": "tombstoned",
      "active_attempt_id": null,
      "lease": null,
      "opened_at": "2026-07-30T02:50:32+00:00",
      "last_verified_at": "2026-08-09T14:57:13+00:00",
      "close_eligibility": "closed_user_approved_worktree_removed",
      "retention_policy": "preserve_branch_and_git_history",
      "hosts": {
        "local": {
          "host_scope": "local",
          "branch": "codex/w003-scientific-records-lifecycle-v1-20260730",
          "path_id": "local_experiment_workspaces",
          "relative_path": "D:\\AI空间转录病理研究\\PFMval_new_governed_workspaces\\W003",
          "current_source_commit": "28e3aeface15c30e8b437509eb64b4048e17a8c8"
        }
      }
    },
    {
      "workspace_kind": "experiment",
      "workspace_id": "W004",
      "display_name": "Phase 3 双线基线与跨队列空间通路迁移",
      "experiment_id": "phase3_dual_baseline_spatial_pathway_transfer_v001_20260804",
      "protocol_revision": 1,
      "status": "shadow",
      "active_attempt_id": null,
      "lease": null,
      "opened_at": "2026-08-04T06:10:27+00:00",
      "last_verified_at": null,
      "close_eligibility": "blocked_pending_result_reconciliation_and_code_review",
      "retention_policy": "retain_until_explicit_close_approval",
      "hosts": {
        "local": {
          "host_scope": "local",
          "branch": "codex/w004-phase3-stage2-source-b898-20260807",
          "path_id": "local_experiment_workspaces",
          "relative_path": "D:\\AI空间转录病理研究\\PFMval_new_governed_workspaces\\W004",
          "current_source_commit": "b898c9d80c2702a32a51773c9cfb8ca75312731a"
        }
      }
    }
  ]
}
